{
  "slug": "google",
  "provider": "Google",
  "source_url": "https://ai.google.dev/pricing",
  "last_updated": "2026-09-27",
  "models": [
    {
      "id": "google-gemini-2.5-flash-payg",
      "name": "Google Gemini 2.5 Flash",
      "type": "pay_as_you_go",
      "provider": "Google",
      "currency": "USD",
      "pricing_per_1m": {
        "cache_hit": 0.025,
        "cache_miss": 0.075,
        "output": 0.3
      },
      "model_type": "reasoning",
      "context_length": 1048576,
      "params_b": null,
      "input_modalities": [
        "file",
        "image",
        "text",
        "audio",
        "video"
      ],
      "output_modalities": [
        "text"
      ],
      "supports_reasoning": true,
      "or_slug": "google/gemini-2.5-flash"
    },
    {
      "id": "google-gemini-2.5-pro-payg",
      "name": "Google Gemini 2.5 Pro",
      "type": "pay_as_you_go",
      "provider": "Google",
      "currency": "USD",
      "pricing_per_1m": {
        "cache_hit": 0.3125,
        "cache_miss": 1.25,
        "output": 5
      },
      "model_type": "reasoning",
      "context_length": 1048576,
      "params_b": null,
      "input_modalities": [
        "text",
        "image",
        "file",
        "audio",
        "video"
      ],
      "output_modalities": [
        "text"
      ],
      "supports_reasoning": true,
      "or_slug": "google/gemini-2.5-pro"
    }
  ]
}
